{
  "status": "failed",
  "exit_code": 1,
  "version": "1.0.0",
  "environment": "production",
  "timestamp": "2026-05-03T21:01:21.535001049+03:00",
  "principles": [
    {
      "Principle": {
        "id": "P001",
        "name": "OpenAPI Specification Compliance",
        "description": "Validates that the API specification follows OpenAPI 3.0/3.1 standards and best practices",
        "category": "Specification",
        "severity": "critical",
        "tags": [
          "openapi",
          "specification",
          "compliance"
        ],
        "auto_fixable": true,
        "checks": [
          "OpenAPI version is 3.0.x or 3.1.0",
          "Required info fields (title, version) are present",
          "Paths are properly defined",
          "Components are valid",
          "References are resolvable",
          "No duplicate operationIds",
          "Valid HTTP methods used"
        ]
      },
      "Passed": true,
      "Message": "OpenAPI specification is fully compliant with 3.0/3.1 standards",
      "Details": {
        "checks": {
          "Components are valid": true,
          "No duplicate operationIds": true,
          "Paths are properly defined": true,
          "Required info fields (title, version) are present": true,
          "Specification structure is valid": true,
          "Specification version is present": true,
          "Valid HTTP methods used": true
        },
        "messages": {}
      },
      "Explanation": "",
      "SuggestedFix": "",
      "TestImpact": null
    },
    {
      "Principle": {
        "id": "P002",
        "name": "API Documentation Quality",
        "description": "Ensures comprehensive and high-quality API documentation including descriptions, examples, and usage guidelines",
        "category": "Documentation",
        "severity": "critical",
        "tags": [
          "documentation",
          "quality",
          "usability"
        ],
        "auto_fixable": true,
        "checks": [
          "All operations have clear summaries",
          "All operations have detailed descriptions",
          "All operations have unique operationIds",
          "All parameters have descriptions",
          "All request/response bodies have examples",
          "All schemas have descriptions",
          "All enums have descriptions",
          "API has a general description",
          "Contact information is provided",
          "License information is provided"
        ]
      },
      "Passed": true,
      "Message": "API documentation is comprehensive and high quality",
      "Details": {
        "checks": {
          "API has a general description": true,
          "Contact information is provided": true,
          "License information is provided": true
        },
        "messages": {},
        "missing_docs": {}
      },
      "Explanation": "",
      "SuggestedFix": "",
      "TestImpact": null
    },
    {
      "Principle": {
        "id": "P003",
        "name": "Error Handling Standards",
        "description": "Validates comprehensive error response documentation and consistent error handling patterns",
        "category": "Error Handling",
        "severity": "critical",
        "tags": [
          "errors",
          "responses",
          "standards"
        ],
        "auto_fixable": true,
        "checks": [
          "All operations document 4xx error responses",
          "All operations document 5xx error responses",
          "Error responses include error codes",
          "Error responses include error messages",
          "Error responses include error details schema",
          "Common error responses are defined in components",
          "Error responses follow consistent format"
        ]
      },
      "Passed": true,
      "Message": "Error handling is well-documented and follows consistent patterns",
      "Details": {
        "checks": {
          "All operations document 4xx error responses": true,
          "All operations document 5xx error responses": true,
          "Common error responses are defined in components": true,
          "Error responses follow consistent format": true,
          "Error responses include error details schema": true
        },
        "messages": {},
        "missing_errors": {}
      },
      "Explanation": "",
      "SuggestedFix": "",
      "TestImpact": null
    },
    {
      "Principle": {
        "id": "P004",
        "name": "Request Schema Definitions",
        "description": "Ensures all API requests have comprehensive schema definitions with proper data types, validation rules, and constraints",
        "category": "Schema",
        "severity": "critical",
        "tags": [
          "schema",
          "validation",
          "request"
        ],
        "auto_fixable": true,
        "checks": [
          "All path parameters have schemas",
          "All query parameters have schemas",
          "All header parameters have schemas",
          "All request bodies have content schemas",
          "All schemas specify data types",
          "All schemas have appropriate constraints",
          "All required fields are marked",
          "All enums have valid values",
          "All numeric fields have min/max values",
          "All string fields have length constraints"
        ]
      },
      "Passed": false,
      "Message": "Request validation issues found: All schemas specify data types: POST /products: application/json schema, PUT /products/{product_id}: application/json schema, POST /tasks: application/json schema, POST /test/echo: application/json schema",
      "Details": {
        "checks": {
          "All enums have valid values": true,
          "All header parameters have schemas": true,
          "All numeric fields have min/max values": true,
          "All path parameters have schemas": true,
          "All query parameters have schemas": true,
          "All request bodies have content schemas": true,
          "All required fields are marked": true,
          "All schemas have appropriate constraints": true,
          "All schemas specify data types": false,
          "All string fields have length constraints": true
        },
        "messages": {},
        "missing_validation": {
          "All schemas specify data types": [
            "POST /products: application/json schema",
            "PUT /products/{product_id}: application/json schema",
            "POST /tasks: application/json schema",
            "POST /test/echo: application/json schema"
          ]
        }
      },
      "Explanation": "",
      "SuggestedFix": "Add comprehensive schema validation including data types, constraints, and required fields",
      "TestImpact": null
    },
    {
      "Principle": {
        "id": "P005",
        "name": "Security Standards",
        "description": "Validates comprehensive security requirements and authentication mechanisms",
        "category": "Security",
        "severity": "critical",
        "tags": [
          "security",
          "authentication",
          "authorization"
        ],
        "auto_fixable": false,
        "checks": [
          "Security schemes are defined",
          "Global security requirements are set",
          "Operation-level security is defined",
          "OAuth2 scopes are documented",
          "API keys are properly described",
          "Authentication headers are specified",
          "Security requirements are consistent"
        ]
      },
      "Passed": true,
      "Message": "All security requirements are properly defined and consistent",
      "Details": {
        "checks": {
          "API keys are properly described": true,
          "Authentication headers are specified": true,
          "Global security requirements are set": true,
          "OAuth2 scopes are documented": true,
          "Operation-level security is defined": true,
          "Security requirements are consistent": true,
          "Security schemes are defined": true
        },
        "messages": {}
      },
      "Explanation": "",
      "SuggestedFix": "",
      "TestImpact": null
    },
    {
      "Principle": {
        "id": "P008",
        "name": "API Versioning Strategy",
        "description": "Validates proper API versioning implementation and documentation",
        "category": "Versioning",
        "severity": "warning",
        "tags": [
          "versioning",
          "compatibility",
          "lifecycle"
        ],
        "auto_fixable": true,
        "checks": [
          "API version is specified",
          "Version follows semantic versioning",
          "Versioning strategy is documented",
          "Deprecation notices are present",
          "Breaking changes are documented",
          "Version compatibility is specified",
          "Migration guides are referenced"
        ]
      },
      "Passed": true,
      "Message": "API versioning strategy is properly documented",
      "Details": {
        "checks": {
          "API version is specified": true,
          "Breaking changes are documented": true,
          "Deprecation notices are present": true,
          "Migration guides are referenced": true,
          "Version compatibility is specified": true,
          "Version follows semantic versioning": true,
          "Versioning strategy is documented": true
        },
        "messages": {}
      },
      "Explanation": "",
      "SuggestedFix": "",
      "TestImpact": null
    }
  ],
  "total_checks": 6,
  "passed_checks": 5,
  "failed_checks": 1,
  "summary": {
    "CriticalIssues": 1,
    "Warnings": 0,
    "Info": 0,
    "Categories": [
      "Schema"
    ],
    "FailedTags": [
      "schema",
      "validation",
      "request"
    ],
    "TestSummary": null
  }
}
