{
  "status": "passed",
  "exit_code": 0,
  "version": "1.0.0",
  "environment": "production",
  "timestamp": "2026-06-09T22:52:00.520527589+03:00",
  "principles": [
    {
      "Principle": {
        "id": "P006",
        "name": "API Contract Testing",
        "description": "Validates that the API implementation matches its specification through functional testing",
        "category": "Testing",
        "severity": "critical",
        "tags": [
          "testing",
          "contract",
          "implementation"
        ],
        "auto_fixable": false,
        "checks": [
          "All endpoints are reachable",
          "Response status codes match documentation",
          "Response schemas match documentation",
          "Authentication works as documented",
          "Required parameters are enforced",
          "Request validation works as documented",
          "Error responses match documentation"
        ]
      },
      "Passed": true,
      "Message": "All documented endpoints are reachable and return documented status codes.",
      "Details": [
        {
          "method": "POST",
          "path": "/tasks",
          "status": "success",
          "status_code": 201,
          "response_time": 1110918,
          "response_body": "eyJpZCI6IjNmNzI5OWYzLThmNTAtNDE1ZC04Y2RhLTcxZjg2NTFjYTA1MyIsInRpdGxlIjoiU2FtcGxlIFRhc2siLCJkZXNjcmlwdGlvbiI6IkV4YW1wbGUgZGVzY3JpcHRpb24ifQ=="
        },
        {
          "method": "POST",
          "path": "/test/echo",
          "status": "success",
          "status_code": 200,
          "response_time": 1120540,
          "response_body": "eyJhY3RpdmUiOnRydWUsIm1lc3NhZ2UiOiJUZXN0IG1lc3NhZ2UiLCJudW1iZXIiOjQyfQ=="
        },
        {
          "method": "GET",
          "path": "/test/health",
          "status": "success",
          "status_code": 200,
          "response_time": 643187,
          "response_body": "eyJzdGF0dXMiOiJoZWFsdGh5IiwidmVyc2lvbiI6IjEuMC4wIiwidGltZXN0YW1wIjoiMjAyNi0wNi0wOVQxOTo1MjowMC41MTU3MTQifQ=="
        },
        {
          "method": "GET",
          "path": "/products",
          "status": "success",
          "status_code": 200,
          "response_time": 924545,
          "response_body": "W3sibmFtZSI6IldpcmVsZXNzIEhlYWRwaG9uZXMiLCJkZXNjcmlwdGlvbiI6Ik5vaXNlLWNhbmNlbGxpbmcgd2lyZWxlc3MgaGVhZHBob25lcyB3aXRoIDIwaCBiYXR0ZXJ5IGxpZmUiLCJwcmljZSI6OTkuOTksImNhdGVnb3J5IjoiZWxlY3Ryb25pY3MiLCJpbl9zdG9jayI6dHJ1ZSwidGFncyI6WyJ3aXJlbGVzcyIsImF1ZGlvIiwiYmx1ZXRvb3RoIl0sImlkIjoiMGZiMTY1N2MtM2IzYy00MTlhLWJmOTgtN2ZkNjUyNjAzMjg1IiwiY3JlYXRlZF9hdCI6IjIwMjYtMDYtMDlUMTk6NDk6MjMuNzA4MzU3IiwidXBkYXRlZF9hdCI6IjIwMjYtMDYtMDlUMTk6NDk6MjMuNzA4MzU3In0seyJuYW1lIjoiQ290dG9uIFQtU2hpcnQiLCJkZXNjcmlwdGlvbiI6IkNvbWZvcnRhYmxlIDEwMCUgY290dG9uIHQtc2hpcnQsIGF2YWlsYWJsZSBpbiBtdWx0aXBsZSBjb2xvcnMiLCJwcmljZSI6MTkuOTksImNhdGVnb3J5IjoiY2xvdGhpbmciLCJpbl9zdG9jayI6dHJ1ZSwidGFncyI6WyJjb3R0b24iLCJjYXN1YWwiLCJzdW1tZXIiXSwiaWQiOiJlYzFkYTllOS0wYWQ0LTQ3ZWMtODJkMy04OWYwZjQ0OGE5NWIiLCJjcmVhdGVkX2F0IjoiMjAyNi0wNi0wOVQxOTo0OToyMy43MDgzNjYiLCJ1cGRhdGVkX2F0IjoiMjAyNi0wNi0wOVQxOTo0OToyMy43MDgzNjYifV0="
        },
        {
          "method": "POST",
          "path": "/products",
          "status": "success",
          "status_code": 201,
          "response_time": 853385,
          "response_body": "eyJuYW1lIjoiV2lyZWxlc3MgSGVhZHBob25lcyIsImRlc2NyaXB0aW9uIjoiTm9pc2UtY2FuY2VsbGluZyB3aXJlbGVzcyBoZWFkcGhvbmVzIHdpdGggMjBoIGJhdHRlcnkgbGlmZSIsInByaWNlIjo5OS45OSwiY2F0ZWdvcnkiOiJlbGVjdHJvbmljcyIsImluX3N0b2NrIjp0cnVlLCJ0YWdzIjpbIndpcmVsZXNzIiwiYXVkaW8iLCJibHVldG9vdGgiXSwiaWQiOiIxYmY5N2MxYy0xYWNmLTRiNTMtOTk2ZS1hMjRmMGU4YzIyYWQiLCJjcmVhdGVkX2F0IjoiMjAyNi0wNi0wOVQxOTo1MjowMC41MTc2MzUiLCJ1cGRhdGVkX2F0IjoiMjAyNi0wNi0wOVQxOTo1MjowMC41MTc2MzUifQ=="
        },
        {
          "method": "DELETE",
          "path": "/products/{product_id}",
          "status": "success",
          "status_code": 404,
          "response_time": 755750,
          "response_body": "eyJkZXRhaWwiOnsiZXJyb3IiOiJQcm9kdWN0IG5vdCBmb3VuZCIsImNvZGUiOjQwNH19",
          "errors": [
            "Missing required field in response: error",
            "Missing required field in response: code"
          ]
        },
        {
          "method": "GET",
          "path": "/products/{product_id}",
          "status": "success",
          "status_code": 404,
          "response_time": 661025,
          "response_body": "eyJkZXRhaWwiOnsiZXJyb3IiOiJQcm9kdWN0IG5vdCBmb3VuZCIsImNvZGUiOjQwNH19",
          "errors": [
            "Missing required field in response: error",
            "Missing required field in response: code"
          ]
        },
        {
          "method": "PUT",
          "path": "/products/{product_id}",
          "status": "success",
          "status_code": 404,
          "response_time": 871841,
          "response_body": "eyJkZXRhaWwiOnsiZXJyb3IiOiJQcm9kdWN0IG5vdCBmb3VuZCIsImNvZGUiOjQwNH19",
          "errors": [
            "Missing required field in response: error",
            "Missing required field in response: code"
          ]
        }
      ],
      "Explanation": "",
      "SuggestedFix": "",
      "TestImpact": null
    }
  ],
  "total_checks": 1,
  "passed_checks": 1,
  "failed_checks": 0,
  "summary": {
    "CriticalIssues": 0,
    "Warnings": 0,
    "Info": 0,
    "Categories": null,
    "FailedTags": null,
    "TestSummary": null
  },
  "test_results": {
    "Functional": {
      "TotalEndpoints": 8,
      "TestedEndpoints": 8,
      "PassedEndpoints": 8,
      "FailedEndpoints": 0,
      "SkippedEndpoints": 0,
      "EndpointResults": [
        {
          "Method": "POST",
          "Path": "/tasks",
          "Status": "passed",
          "StatusCode": 201,
          "ResponseTime": 1110918,
          "Errors": null,
          "Warnings": null,
          "TestCases": null
        },
        {
          "Method": "POST",
          "Path": "/test/echo",
          "Status": "passed",
          "StatusCode": 200,
          "ResponseTime": 1120540,
          "Errors": null,
          "Warnings": null,
          "TestCases": null
        },
        {
          "Method": "GET",
          "Path": "/test/health",
          "Status": "passed",
          "StatusCode": 200,
          "ResponseTime": 643187,
          "Errors": null,
          "Warnings": null,
          "TestCases": null
        },
        {
          "Method": "GET",
          "Path": "/products",
          "Status": "passed",
          "StatusCode": 200,
          "ResponseTime": 924545,
          "Errors": null,
          "Warnings": null,
          "TestCases": null
        },
        {
          "Method": "POST",
          "Path": "/products",
          "Status": "passed",
          "StatusCode": 201,
          "ResponseTime": 853385,
          "Errors": null,
          "Warnings": null,
          "TestCases": null
        },
        {
          "Method": "DELETE",
          "Path": "/products/{product_id}",
          "Status": "passed",
          "StatusCode": 404,
          "ResponseTime": 755750,
          "Errors": [
            "Missing required field in response: error",
            "Missing required field in response: code"
          ],
          "Warnings": null,
          "TestCases": null
        },
        {
          "Method": "GET",
          "Path": "/products/{product_id}",
          "Status": "passed",
          "StatusCode": 404,
          "ResponseTime": 661025,
          "Errors": [
            "Missing required field in response: error",
            "Missing required field in response: code"
          ],
          "Warnings": null,
          "TestCases": null
        },
        {
          "Method": "PUT",
          "Path": "/products/{product_id}",
          "Status": "passed",
          "StatusCode": 404,
          "ResponseTime": 871841,
          "Errors": [
            "Missing required field in response: error",
            "Missing required field in response: code"
          ],
          "Warnings": null,
          "TestCases": null
        }
      ],
      "AverageResponseTime": 867648,
      "MaxResponseTime": 1120540,
      "MinResponseTime": 643187
    },
    "Performance": null,
    "StartTime": "2026-06-09T22:52:00.520527697+03:00",
    "EndTime": "2026-06-09T22:52:00.520527761+03:00",
    "Status": "passed"
  }
}